<?xml version="1.0" encoding="UTF-8"?>
<configurazione
xsi:noNamespaceSchemaLocation="configurazione.xsd">
	<database>
		<tipo></tipo>
		<nome></nome>
		<server></server>
		<porta></porta>
		<username></username>
		<password></password>
	</database>
</configurazione>